{
  "candidate_id": "CAND-004",
  "audit_started_on": "2026-10-05",
  "audit_completed_on": "2026-10-05",
  "visible_form_searches": [
    {
      "searched_on": "2026-10-05",
      "source_or_engine": "Web search",
      "query": "richer gives poorer exactly poorer's amount doubling game when equal integers",
      "filters_or_scope": null,
      "result_summary": "Found an almost literal MathOverflow formulation with two positive integers, smaller doubled and larger reduced by the smaller.",
      "promising_hits": []
    },
    {
      "searched_on": "2026-10-05",
      "source_or_engine": "The Mathematical Gazette archive / web index",
      "query": "Mathematical Gazette doubling transfer game two integers equality",
      "filters_or_scope": null,
      "result_summary": "No exact Gazette Problem Corner hit was located.",
      "promising_hits": []
    },
    {
      "searched_on": "2026-10-05",
      "source_or_engine": "MathOverflow",
      "query": "Property of a map on the 2D lattice smaller doubles larger subtracts smaller",
      "filters_or_scope": null,
      "result_summary": "Found the exact state update and the same termination/equality question.",
      "promising_hits": [
        "https://mathoverflow.net/questions/368327/property-of-a-map-on-the-2d-lattice"
      ]
    }
  ],
  "equivalence_model": {
    "story_stripped_kernel": "For positive integers x,y with constant S=x+y, update the smaller coordinate to twice itself and the larger to larger-minus-smaller; stop at equality. Equivalently one coordinate follows doubling modulo S. Classify initial states whose orbit hits S/2.",
    "transformations_checked": [
      "friends' money ↔ positive integer pair",
      "transfer rule ↔ map (x,y)->(2x,y-x) up to swapping",
      "one coordinate ↔ residue modulo the conserved sum",
      "gcd reduction ↔ primitive pair p,q"
    ],
    "invariants_or_signature": [
      "constant sum",
      "doubling modulo S",
      "termination iff reduced sum is a power of two",
      "criterion (a+b)/gcd(a,b)=2^m"
    ],
    "equivalence_notes": "The transfer narrative is exactly the standard two-coordinate map once the richer/poorer labels are forgotten."
  },
  "equivalent_form_searches": [
    {
      "searched_on": "2026-10-05",
      "source_or_engine": "Mathematics Stack Exchange",
      "query": "When does (a,b) -> (2a,b-a) terminate?",
      "filters_or_scope": null,
      "result_summary": "Found a 2014 question with the same update and an answer: after reducing gcd, termination iff p+q is a power of two.",
      "promising_hits": [
        "https://math.stackexchange.com/questions/853532/when-does-a-b-to-2a-b-a-terminate-a-leq-b"
      ]
    },
    {
      "searched_on": "2026-10-05",
      "source_or_engine": "MathOverflow",
      "query": "two dimensional lattice map double smaller subtract smaller termination",
      "filters_or_scope": null,
      "result_summary": "Found a 2020 question describing exactly the same map and asking the same iff termination condition.",
      "promising_hits": [
        "https://mathoverflow.net/questions/368327/property-of-a-map-on-the-2d-lattice"
      ]
    },
    {
      "searched_on": "2026-10-05",
      "source_or_engine": "Web / modular dynamics",
      "query": "doubling modulo conserved sum gcd power two orbit half modulus",
      "filters_or_scope": null,
      "result_summary": "Returned standard modular-doubling language; this corroborates the representation but the direct Q&A hits are already decisive.",
      "promising_hits": []
    }
  ],
  "source_classes": [
    {
      "class": "The Mathematical Gazette / Problem Corner archive",
      "searched": true,
      "notes": "Targeted Cambridge Core, Taylor & Francis and web-index searches were run for the candidate surface and stripped kernel; no exact Gazette Problem Corner hit was found unless noted in findings."
    },
    {
      "class": "Other mathematical problem journals / problem archives",
      "searched": true,
      "notes": "Targeted problem-archive and mathematical Q&A searches were used where the elementary formulation made them likely to surface prior art."
    },
    {
      "class": "Olympiad and contest problem collections",
      "searched": false,
      "notes": "Not a priority source class after stronger, directly equivalent research/Q&A prior art was found; omission is deliberate."
    },
    {
      "class": "Recreational mathematics collections and books",
      "searched": true,
      "notes": "Targeted recreational/book searches were run."
    },
    {
      "class": "General mathematical literature",
      "searched": true,
      "notes": "Scholarly and general web searches were run using story-stripped terminology and theorem signatures."
    },
    {
      "class": "Mathematics Stack Exchange",
      "searched": true,
      "notes": "Targeted searches were run for equivalent elementary formulations."
    },
    {
      "class": "MathOverflow",
      "searched": true,
      "notes": "Targeted searches were run for equivalent research-level formulations."
    },
    {
      "class": "OEIS",
      "searched": true,
      "notes": "Checked where the candidate naturally generates a sequence/statistic."
    },
    {
      "class": "Searchable web",
      "searched": true,
      "notes": "Multiple visible and equivalent-form phrasings were searched and promising hits were inspected."
    },
    {
      "class": "Academic papers",
      "searched": true,
      "notes": "Relevant papers/abstracts were inspected where the kernel belongs to an established field."
    }
  ],
  "findings": [
    {
      "source": "Mathematics Stack Exchange — When does (a,b) -> (2a,b-a) terminate?",
      "url_or_citation": "https://math.stackexchange.com/questions/853532/when-does-a-b-to-2a-b-a-terminate-a-leq-b",
      "relationship": "Same update rule; after gcd reduction, answer states termination iff p+q=2^m.",
      "materiality": "identical",
      "notes": "This is exactly equivalent to (a+b)/gcd(a,b) being a power of two."
    },
    {
      "source": "MathOverflow — Property of a map on the 2D lattice",
      "url_or_citation": "https://mathoverflow.net/questions/368327/property-of-a-map-on-the-2d-lattice",
      "relationship": "Defines f(x,y)=(2x,y-x) or (x-y,2y) according to order and asks for which positive integer pairs an iterate reaches (c,c).",
      "materiality": "identical",
      "notes": "The visible story differs only by using lengths rather than money; the mathematical process and question are the same."
    }
  ],
  "coverage_assessment": {
    "strength": "strong",
    "gaps": [
      "The broader modular-dynamics literature was not exhaustively catalogued because exact prior-art formulations were already found."
    ],
    "why_reasonably_strong_or_not": "Two independent public formulations precede the candidate and one gives the exact reduced-sum power-of-two criterion."
  },
  "final_classification": "REDISCOVERY",
  "classification_rationale": "The update rule, termination question and power-of-two criterion already appear essentially verbatim on Mathematics Stack Exchange and MathOverflow. This candidate cannot survive by changing lengths to money.",
  "follow_up_required": [
    "Do not select. Transient-length or orbit-structure refinements would be new questions and would require their own audit; they are not silent replacements for the frozen candidate."
  ]
}
