{
  "candidate_id": "CAND-001",
  "audit_started_on": "2026-10-05",
  "audit_completed_on": "2026-10-05",
  "visible_form_searches": [
    {
      "searched_on": "2026-10-05",
      "source_or_engine": "Web search",
      "query": "random pairing round table ribbons expected crossing pairs",
      "filters_or_scope": null,
      "result_summary": "Surface searches quickly converged on the classical random-chord / chord-diagram formulation; changing people/ribbons to endpoints/chords removes no mathematical content.",
      "promising_hits": [
        "Mathematics Stack Exchange: Expected number of intersection points when n random chords are drawn in a circle"
      ]
    },
    {
      "searched_on": "2026-10-05",
      "source_or_engine": "The Mathematical Gazette archive / web index",
      "query": "Mathematical Gazette Problem Corner random chords crossings pairing circle",
      "filters_or_scope": null,
      "result_summary": "No exact Gazette Problem Corner item was located in indexed results. This negative result is not treated as originality evidence.",
      "promising_hits": []
    },
    {
      "searched_on": "2026-10-05",
      "source_or_engine": "Mathematics Stack Exchange",
      "query": "expected number of intersection points n random chords circle",
      "filters_or_scope": null,
      "result_summary": "Found an answer using exactly the four-endpoint / three-pairing argument and giving n(n-1)/6.",
      "promising_hits": [
        "https://math.stackexchange.com/questions/73033/expected-number-of-intersection-points-when-n-random-chords-are-drawn-in-a-cir"
      ]
    }
  ],
  "equivalence_model": {
    "story_stripped_kernel": "Choose a uniform perfect matching of 2n cyclically ordered points and count crossing matched-edge pairs. For any two matching edges, their four endpoints induce three equiprobable pairings and exactly one crosses.",
    "transformations_checked": [
      "people at seats ↔ cyclically ordered labelled endpoints",
      "ribbons ↔ chords / matched edges",
      "uniform pairing ↔ uniform chord diagram / perfect matching",
      "number of crossing ribbon pairs ↔ number of edges in the chord-intersection graph"
    ],
    "invariants_or_signature": [
      "uniform perfect matching on 2n cyclic points",
      "crossing probability 1/3 for a chosen pair of chords",
      "expectation n(n-1)/6",
      "four-endpoint symmetry / linearity of expectation"
    ],
    "equivalence_notes": "The story contributes no restriction beyond the standard uniform chord-diagram model."
  },
  "equivalent_form_searches": [
    {
      "searched_on": "2026-10-05",
      "source_or_engine": "Scholarly web / arXiv",
      "query": "uniform random chord diagram number of crossings expectation",
      "filters_or_scope": null,
      "result_summary": "Found established random-chord-diagram literature; Acan's paper uses exactly a uniformly random chord diagram and treats its intersection graph.",
      "promising_hits": [
        "Hüseyin Acan, On a uniformly random chord diagram and its intersection graph, Discrete Mathematics 340 (2017)"
      ]
    },
    {
      "searched_on": "2026-10-05",
      "source_or_engine": "Web search",
      "query": "perfect matching circle crossing pairs expectation n(n-1)/6",
      "filters_or_scope": null,
      "result_summary": "Returned direct statements of the same mean and the same four-point symmetry.",
      "promising_hits": []
    },
    {
      "searched_on": "2026-10-05",
      "source_or_engine": "OEIS / sequence search",
      "query": "chord diagrams crossings number of crossings random matching",
      "filters_or_scope": null,
      "result_summary": "Confirmed that crossing statistics of chord diagrams are established enumerative objects; sequence-level checking was supplementary, not the decisive evidence.",
      "promising_hits": []
    }
  ],
  "source_classes": [
    {
      "class": "The Mathematical Gazette / Problem Corner archive",
      "searched": true,
      "notes": "Targeted Cambridge Core, Taylor & Francis and web-index searches were run for the candidate surface and stripped kernel; no exact Gazette Problem Corner hit was found unless noted in findings."
    },
    {
      "class": "Other mathematical problem journals / problem archives",
      "searched": true,
      "notes": "Targeted problem-archive and mathematical Q&A searches were used where the elementary formulation made them likely to surface prior art."
    },
    {
      "class": "Olympiad and contest problem collections",
      "searched": false,
      "notes": "Not a priority source class after stronger, directly equivalent research/Q&A prior art was found; omission is deliberate."
    },
    {
      "class": "Recreational mathematics collections and books",
      "searched": true,
      "notes": "Targeted recreational/book searches were run."
    },
    {
      "class": "General mathematical literature",
      "searched": true,
      "notes": "Scholarly and general web searches were run using story-stripped terminology and theorem signatures."
    },
    {
      "class": "Mathematics Stack Exchange",
      "searched": true,
      "notes": "Targeted searches were run for equivalent elementary formulations."
    },
    {
      "class": "MathOverflow",
      "searched": true,
      "notes": "Targeted searches were run for equivalent research-level formulations."
    },
    {
      "class": "OEIS",
      "searched": true,
      "notes": "Checked where the candidate naturally generates a sequence/statistic."
    },
    {
      "class": "Searchable web",
      "searched": true,
      "notes": "Multiple visible and equivalent-form phrasings were searched and promising hits were inspected."
    },
    {
      "class": "Academic papers",
      "searched": true,
      "notes": "Relevant papers/abstracts were inspected where the kernel belongs to an established field."
    }
  ],
  "findings": [
    {
      "source": "Mathematics Stack Exchange — Expected number of intersection points when n random chords are drawn in a circle",
      "url_or_citation": "https://math.stackexchange.com/questions/73033/expected-number-of-intersection-points-when-n-random-chords-are-drawn-in-a-cir",
      "relationship": "Uses four endpoints, notes the three pairings are equiprobable, one crosses, and obtains n(n-1)/6.",
      "materiality": "near_identical",
      "notes": "The sampling description is not literally 'a uniform perfect matching of fixed seats', but the decisive local law and expected value are exactly the frozen candidate's mechanism."
    },
    {
      "source": "Hüseyin Acan, On a uniformly random chord diagram and its intersection graph, Discrete Mathematics 340 (2017)",
      "url_or_citation": "https://doi.org/10.1016/j.disc.2016.11.004",
      "relationship": "Uses the exact story-stripped object: a uniformly random chord diagram / perfect matching of cyclic endpoints, and places crossing statistics in established literature.",
      "materiality": "material",
      "notes": "Together with the direct elementary solution above, this removes any defensible novelty claim for the frozen problem."
    }
  ],
  "coverage_assessment": {
    "strength": "strong",
    "gaps": [
      "The Gazette backfile was searched through online indexing rather than manually page-by-page.",
      "No attempt was made to exhaust every recreational book once exact mathematical prior art had been found."
    ],
    "why_reasonably_strong_or_not": "The exact model is a standard random chord diagram and the exact mean/proof already appears publicly in elementary form; additional source classes cannot restore novelty."
  },
  "final_classification": "REDISCOVERY",
  "classification_rationale": "The frozen problem is the standard expected crossing count for a uniformly random chord diagram. The answer n(n-1)/6 and the four-endpoint, one-of-three-pairings proof are already public. A different ribbon story is cosmetic.",
  "follow_up_required": [
    "Do not select. Any salvage would need a materially different statistic or constrained matching model; merely changing the story is not salvage."
  ]
}
