{
  "candidate_id": "CAND-005",
  "audit_started_on": "2026-10-05",
  "audit_completed_on": "2026-10-05",
  "visible_form_searches": [
    {
      "searched_on": "2026-10-05",
      "source_or_engine": "Web search",
      "query": "delete point between current neighbours sequence final local maxima minima order independent",
      "filters_or_scope": null,
      "result_summary": "No exact match to the asynchronous 'delete any currently monotone middle point' confluence question was located. Search results instead clustered around turning-point simplification and alternating subsequences.",
      "promising_hits": []
    },
    {
      "searched_on": "2026-10-05",
      "source_or_engine": "The Mathematical Gazette archive / web index",
      "query": "Mathematical Gazette delete intermediate points local extrema sequence order independent",
      "filters_or_scope": null,
      "result_summary": "No exact Gazette/Problem Corner hit was found in indexed searching; this is not proof of novelty.",
      "promising_hits": []
    },
    {
      "searched_on": "2026-10-05",
      "source_or_engine": "Problem/Q&A search",
      "query": "monotone triple delete middle element local extrema confluence",
      "filters_or_scope": null,
      "result_summary": "No exact same rewrite problem surfaced in targeted Q&A/problem-source searching.",
      "promising_hits": []
    }
  ],
  "equivalence_model": {
    "story_stripped_kernel": "For a sequence of distinct real numbers, repeatedly delete an interior term lying strictly between its current neighbors. In the sign word of consecutive differences, this contracts ++ to + and -- to -. The rewrite system should have a unique normal form, whose surviving entries are the original endpoints and local extrema.",
    "transformations_checked": [
      "village altitudes ↔ arbitrary distinct real sequence / permutation",
      "between-neighbours deletion ↔ removal of a point on a monotone run",
      "height sequence ↔ sign word of first differences",
      "deletion ↔ contraction of adjacent equal signs",
      "survivors ↔ turning points / peaks and valleys / canonical alternating subsequence"
    ],
    "invariants_or_signature": [
      "run compression of +/- word",
      "unique reduced alternating sign word",
      "endpoints plus local extrema",
      "order independence / confluence"
    ],
    "equivalence_notes": "The survivor set is close to established turning-point and longest-alternating-subsequence constructions; the distinctive part of the frozen question is arbitrary-order deletion and confluence."
  },
  "equivalent_form_searches": [
    {
      "searched_on": "2026-10-05",
      "source_or_engine": "Academic literature",
      "query": "local extrema permutations canonical longest alternating subsequence monotone intervals",
      "filters_or_scope": null,
      "result_summary": "Found Dan Romik's 2011 paper: local extrema (with endpoint convention) form a canonical longest alternating subsequence, and segments between successive extrema are monotone.",
      "promising_hits": [
        "https://dmtcs.episciences.org/2956"
      ]
    },
    {
      "searched_on": "2026-10-05",
      "source_or_engine": "Algorithm / web search",
      "query": "wiggle subsequence keep local maxima minima delete monotone slope",
      "filters_or_scope": null,
      "result_summary": "Found standard wiggle-subsequence explanations that discard points on monotone slopes and retain peaks/valleys; related output, but not the same arbitrary rewrite/confluence question.",
      "promising_hits": []
    },
    {
      "searched_on": "2026-10-05",
      "source_or_engine": "Rewrite/confluence search",
      "query": "delete monotone middle point sequence order independent sign run compression",
      "filters_or_scope": null,
      "result_summary": "No exact prior result for this specific rewrite system was found in indexed results.",
      "promising_hits": []
    },
    {
      "searched_on": "2026-10-05",
      "source_or_engine": "Turning-point compression search",
      "query": "sequence compression local maxima minima preserve turning points",
      "filters_or_scope": null,
      "result_summary": "Found established use of local extrema as shape/turning-point compression; related context rather than an identical puzzle.",
      "promising_hits": []
    }
  ],
  "source_classes": [
    {
      "class": "The Mathematical Gazette / Problem Corner archive",
      "searched": true,
      "notes": "Targeted Cambridge Core, Taylor & Francis and web-index searches were run for the candidate surface and stripped kernel; no exact Gazette Problem Corner hit was found unless noted in findings."
    },
    {
      "class": "Other mathematical problem journals / problem archives",
      "searched": true,
      "notes": "Targeted problem-archive and mathematical Q&A searches were used where the elementary formulation made them likely to surface prior art."
    },
    {
      "class": "Olympiad and contest problem collections",
      "searched": true,
      "notes": "Targeted problem-collection/AoPS-style searches for monotone-triple deletion and peaks/valleys did not locate the exact confluence question."
    },
    {
      "class": "Recreational mathematics collections and books",
      "searched": true,
      "notes": "Targeted recreational/book searches were run."
    },
    {
      "class": "General mathematical literature",
      "searched": true,
      "notes": "Scholarly and general web searches were run using story-stripped terminology and theorem signatures."
    },
    {
      "class": "Mathematics Stack Exchange",
      "searched": true,
      "notes": "Targeted searches were run for equivalent elementary formulations."
    },
    {
      "class": "MathOverflow",
      "searched": false,
      "notes": "Not a high-yield class for this candidate; omission is deliberate."
    },
    {
      "class": "OEIS",
      "searched": false,
      "notes": "Not naturally sequence-led or no distinctive sequence was needed for the audit."
    },
    {
      "class": "Searchable web",
      "searched": true,
      "notes": "Multiple visible and equivalent-form phrasings were searched and promising hits were inspected."
    },
    {
      "class": "Academic papers",
      "searched": true,
      "notes": "Relevant papers/abstracts were inspected where the kernel belongs to an established field."
    }
  ],
  "findings": [
    {
      "source": "Dan Romik, Local extrema in random permutations and the structure of longest alternating subsequences, DMTCS Proceedings (2011)",
      "url_or_citation": "https://dmtcs.episciences.org/2956",
      "relationship": "Shows that the local extrema of a sequence, with endpoint conventions, form a canonical longest alternating subsequence; between successive extrema the sequence is monotone.",
      "materiality": "related",
      "notes": "This substantially overlaps the candidate's terminal object (turning points/local extrema), but it does not pose or prove the arbitrary-order deletion/confluence statement."
    },
    {
      "source": "Standard wiggle / alternating-subsequence algorithms",
      "url_or_citation": null,
      "relationship": "Greedy descriptions commonly remove or ignore interior points of monotone slopes and retain peaks/valleys.",
      "materiality": "related",
      "notes": "The output shape is familiar. The frozen candidate's mathematical claim is stronger/different: every legal asynchronous deletion order reaches the same actual subsequence."
    }
  ],
  "coverage_assessment": {
    "strength": "reasonably_strong",
    "gaps": [
      "Elementary sequence-reduction problems are poorly indexed and may exist in books, contest archives or classroom material under different wording.",
      "The Gazette backfile was not manually inspected page-by-page.",
      "The exact confluence statement may be implicit in an algorithmic source even where not stated as a theorem."
    ],
    "why_reasonably_strong_or_not": "Searches found close, mathematically meaningful prior art for the survivor set but not the frozen arbitrary-order rewrite problem. That supports a cautious related-prior-art classification, not CLEAR and not a claim of proved originality."
  },
  "final_classification": "CLEAR_WITH_RELATED_PRIOR_ART",
  "classification_rationale": "The endpoints/local-extrema normal form is closely related to canonical alternating subsequences and standard peak/valley simplification, so the candidate is not isolated from prior art. However, the audit did not find the specific process 'repeatedly delete any current middle point lying between its neighbours' together with the order-independence theorem. The confluence mechanism is materially more specific than merely identifying a longest wiggle subsequence.",
  "follow_up_required": [
    "If this becomes primary later, Stage 5 should re-audit the exact deletion wording against problem books/contest archives and algorithmic 'polyline simplification' terminology.",
    "Keep the prior-art relationship to canonical alternating subsequences explicit in editor background notes if submitted."
  ]
}
