{
  "candidate_id": "CAND-008",
  "audit_started_on": "2026-10-05",
  "audit_completed_on": "2026-10-05",
  "visible_form_searches": [
    {
      "searched_on": "2026-10-05",
      "source_or_engine": "Web search",
      "query": "round each number then add versus add then round maximum discrepancy",
      "filters_or_scope": null,
      "result_summary": "Found a direct Mathematical Gazette article on whether rounded numbers add correctly and older College Mathematics Journal work on 'sum of the rounds' versus 'round of the sum'.",
      "promising_hits": []
    },
    {
      "searched_on": "2026-10-05",
      "source_or_engine": "The Mathematical Gazette archive / Cambridge Core",
      "query": "Will my numbers add up correctly if I round them",
      "filters_or_scope": null,
      "result_summary": "Found David Hopkins, Mathematical Gazette 100 (2016), pp. 396-409; its references include the 1987 CMJ paper on exactly the sum-of-rounds / round-of-sum comparison.",
      "promising_hits": [
        "https://www.cambridge.org/core/journals/mathematical-gazette/article/abs/will-my-numbers-add-up-correctly-if-i-round-them/88F5753DFE9F0DDDEAD1F2552B0F8B22"
      ]
    },
    {
      "searched_on": "2026-10-05",
      "source_or_engine": "The Mathematical Gazette archive / Cambridge Core",
      "query": "An interesting family of cosine integrals rounding maximum possible error",
      "filters_or_scope": null,
      "result_summary": "Found Hopkins (2025), whose extract explicitly says the earlier article derived the probability of a difference t when n numbers are rounded before versus after addition, with t bounded by the maximum possible error.",
      "promising_hits": [
        "https://www.cambridge.org/core/journals/mathematical-gazette/article/an-interesting-family-of-cosine-integrals/B62280A08A1AA5174383005CB99F388B"
      ]
    }
  ],
  "equivalence_model": {
    "story_stripped_kernel": "For n real numbers without half-unit ties, compare sum_i round(x_i) with round(sum_i x_i); determine the maximum absolute integer discrepancy. Currency conversion merely chooses the unit as a penny.",
    "transformations_checked": [
      "pence/currency conversion ↔ arbitrary real numbers measured in rounding units",
      "round each purchase then sum ↔ sum of the rounds",
      "sum exact then round ↔ round of the sum",
      "worst pence difference ↔ maximum rounding discrepancy"
    ],
    "invariants_or_signature": [
      "individual errors in (-1/2,1/2)",
      "integer discrepancy",
      "maximum possible error as a function of n",
      "sum of rounds vs round of sum"
    ],
    "equivalence_notes": "The banking story has no mathematical restriction beyond ordinary nearest-integer rounding."
  },
  "equivalent_form_searches": [
    {
      "searched_on": "2026-10-05",
      "source_or_engine": "Journal search",
      "query": "The probability that the sum of the rounds equals the round of the sum",
      "filters_or_scope": null,
      "result_summary": "Located the 1987 College Mathematics Journal article by Roger B. Nelsen and James E. Schultz, cited by the Gazette article.",
      "promising_hits": [
        "Nelsen & Schultz, College Mathematics Journal 18(5), 1987, pp. 390-396"
      ]
    },
    {
      "searched_on": "2026-10-05",
      "source_or_engine": "The Mathematical Gazette",
      "query": "rounding before as opposed to after addition maximum possible error n numbers",
      "filters_or_scope": null,
      "result_summary": "The 2025 Gazette extract explicitly describes the distribution of the difference t and refers to its maximum possible error.",
      "promising_hits": [
        "David Hopkins, An interesting family of cosine integrals, Math. Gaz. 109 (2025)"
      ]
    },
    {
      "searched_on": "2026-10-05",
      "source_or_engine": "General web",
      "query": "sum of rounds round of sum discrepancy many numbers",
      "filters_or_scope": null,
      "result_summary": "Found many expository treatments; these are supplementary to the directly relevant Gazette/CMJ literature.",
      "promising_hits": []
    }
  ],
  "source_classes": [
    {
      "class": "The Mathematical Gazette / Problem Corner archive",
      "searched": true,
      "notes": "Direct target-journal prior art was found: Hopkins (2016) treats rounding a list and its sum; Hopkins (2025) explicitly revisits the before/after-addition difference and its maximum possible error."
    },
    {
      "class": "Other mathematical problem journals / problem archives",
      "searched": true,
      "notes": "The 1987 College Mathematics Journal article specifically studies 'sum of the rounds' versus 'round of the sum'."
    },
    {
      "class": "Olympiad and contest problem collections",
      "searched": false,
      "notes": "Not a priority source class after stronger, directly equivalent research/Q&A prior art was found; omission is deliberate."
    },
    {
      "class": "Recreational mathematics collections and books",
      "searched": true,
      "notes": "Targeted recreational/book searches were run."
    },
    {
      "class": "General mathematical literature",
      "searched": true,
      "notes": "Scholarly and general web searches were run using story-stripped terminology and theorem signatures."
    },
    {
      "class": "Mathematics Stack Exchange",
      "searched": true,
      "notes": "Targeted searches were run for equivalent elementary formulations."
    },
    {
      "class": "MathOverflow",
      "searched": false,
      "notes": "Not a high-yield class for this candidate; omission is deliberate."
    },
    {
      "class": "OEIS",
      "searched": false,
      "notes": "Not naturally sequence-led or no distinctive sequence was needed for the audit."
    },
    {
      "class": "Searchable web",
      "searched": true,
      "notes": "Multiple visible and equivalent-form phrasings were searched and promising hits were inspected."
    },
    {
      "class": "Academic papers",
      "searched": true,
      "notes": "Relevant papers/abstracts were inspected where the kernel belongs to an established field."
    }
  ],
  "findings": [
    {
      "source": "David Hopkins, Will my numbers add up correctly if I round them?, The Mathematical Gazette 100 (2016), 396-409",
      "url_or_citation": "https://doi.org/10.1017/mag.2016.104",
      "relationship": "Studies discrepancies caused by rounding components of a list; references the earlier CMJ paper explicitly comparing the sum of the rounds with the round of the sum.",
      "materiality": "material",
      "notes": "This is prior art in the exact target journal and directly on the frozen kernel."
    },
    {
      "source": "Roger B. Nelsen and James E. Schultz, The probability that the 'sum of the rounds' equals the 'round of the sum', College Mathematics Journal 18(5) (1987), 390-396",
      "url_or_citation": null,
      "relationship": "The title is the exact story-stripped comparison underlying the candidate.",
      "materiality": "near_identical",
      "notes": "The frozen candidate asks a worst-case extremal rather than the probability of equality, but it is not a new mathematical setting."
    },
    {
      "source": "David Hopkins, An interesting family of cosine integrals, The Mathematical Gazette 109 (2025), 449-461",
      "url_or_citation": "https://doi.org/10.1017/mag.2025.10125",
      "relationship": "States that the previous work gave the probability of a difference t when n numbers are rounded before rather than after addition and explicitly refers to t's maximum possible error.",
      "materiality": "material",
      "notes": "This strongly indicates that the extremal range itself is already part of the Gazette treatment; the indexed extract does not render the formula image, so the audit does not overclaim an exact displayed floor(n/2) match."
    }
  ],
  "coverage_assessment": {
    "strength": "strong",
    "gaps": [
      "The 2016/2025 formulae include image-rendered mathematics not fully exposed in text indexing, so this audit does not claim to have independently read every displayed bound from those articles.",
      "The 1987 CMJ full text was not required to establish the close mathematical overlap."
    ],
    "why_reasonably_strong_or_not": "Prior art exists in the exact target journal and an earlier mathematics journal for the same before/after rounding discrepancy; the 2025 Gazette extract explicitly discusses the maximum possible error."
  },
  "final_classification": "TOO_CLOSE_TO_EXISTING_PROBLEM",
  "classification_rationale": "Even without relying on a hidden displayed formula, the frozen question lies directly inside established 'sum of the rounds versus round of the sum' work, including two Gazette articles and a 1987 CMJ paper. A currency-conversion surface is not enough separation.",
  "follow_up_required": [
    "Do not select. Any salvage must ask a materially different rounding theorem, not merely change currency, tie conventions or constants."
  ]
}
